Sheet: Sheet1
F1: Sprint 1 | I1: Sprint 2 | L1: Sprint 3 | O1: Sprint 4 | R1: Sprint 5 | U1: Sprint 6 | Y1: Planned Velocities | Z1: Actual Velocities | AA1: Total Planned Story Points | AB1: Total Completed Story Points
F2: Goal: MVP, front-end only | I2: Goal: AI impl | L2: Goal: Impl Networked Multiplayer | O2: Goal: Finish Impl. Networked Multiplayer | R2: Goal: Connect frontend to backend | U2: Goal: Refinement of product | Y2: of:=[.H4] -> 159 | Z2: of:=[.H5] -> 129 | AA2: 159 | AB2: of:=[.$Z2] -> 129
F3: Start = Feb. 28, End = Mar. 6 | I3: Start = Mar. 7, End Mar. 13 | L3: Start = Mar. 14, End Mar. 20 | O3: Start = Mar. 28, End Apr. 3 | R3: Start = Apr. 4, End Apr. 10 | U3: Start = Apr. 25, End May 1 | Y3: of:=[.K4] -> 184 | Z3: of:=[.K5] -> 44 | AA3: of:=SUMIFS([.$D$8:.$D$31];[.$H$8:.$H$31];"=X")+SUMIFS([.$D$8:.$D$31];[.$J$8:.$J$31];"=X") -> 313 | AB3: of:=SUM([.$Z2:.$Z3]) -> 173
F4: Planned Vel. = | H4: of:=SUMIFS([.$D8:.$D101];[.$G8:.$G101];"=X") -> 159 | I4: Planned Vel. = | K4: of:=SUMIFS([.$D8:.$D101];[.$J8:.$J101];"=X") -> 184 | L4: Planned Vel. = | N4: of:=SUMIFS([.$D8:.$D101];[.$M8:.$M101];"=X") -> 172 | O4: Planned Vel. = | Q4: of:=SUMIFS([.$D8:.$D101];[.$P8:.$P101];"=X") -> 338 | R4: Planned Vel. = | T4: of:=SUMIFS([.$D$7:.$D$30];[.$S$7:.$S$30];"=X") -> 239 | U4: Planned Vel. = | W4: of:=SUMIFS([.$D$7:.$D$31];[.$V$7:.$V$31];"=X") -> 227 | Y4: of:=[.N4] -> 172 | Z4: of:=[.N5] -> 0 | AA4: of:=SUMIFS([.$D$8:.$D$31];[.$H$8:.$H$31];"=X")+SUMIFS([.$D$8:.$D$31];[.$K$8:.$K$31];"=X")+SUMIFS([.$D$8:.$D$31];[.$M$8:.$M$31];"=X") -> 345 | AB4: of:=SUM([.$Z2:.$Z4]) -> 173
F5: Actual Vel. = | H5: of:=SUMIFS([.$D8:.$D101];[.$H8:.$H101];"=X") -> 129 | I5: Actual Vel. = | K5: of:=SUMIFS([.$D8:.$D101];[.$K8:.$K101];"=X") -> 44 | L5: Actual Vel. = | N5: of:=SUMIFS([.$D8:.$D101];[.$N8:.$N101];"=X") -> 0 | O5: Actual Vel. = | Q5: of:=SUMIFS([.$D8:.$D101];[.$Q8:.$Q101];"=X") -> 206 | R5: Actual Vel. = | T5: of:=SUMIFS([.$D$7:.$D$30];[.$T$7:.$T$30];"=X") -> 239 | U5: Actual Vel. = | W5: of:=SUMIFS([.$D$7:.$D$31];[.$W$7:.$W$31];"=X") -> 175 | Y5: of:=[.Q4] -> 338 | Z5: of:=[.Q5] -> 206 | AA5: of:=SUMIFS([.$D$8:.$D$31];[.$H$8:.$H$31];"=X")+SUMIFS([.$D$8:.$D$31];[.$K$8:.$K$31];"=X")+SUMIFS([.$D$8:.$D$31];[.$N$8:.$N$31];"=X")+SUMIFS([.$D$8:.$D$31];[.$P$8:.$P$31];"=X") -> 511 | AB5: of:=SUM([.$Z2:.$Z5]) -> 379
A6: Short Title | B6: Theme | C6: Kano Category | D6: Story Points | E6: Priority | F6: Pri | G6: In | H6: Done | I6: Pri | J6: In | K6: Done | L6: Pri | M6: In | N6: Done | O6: Pri | P6: In | Q6: Done | R6: Pri | S6: In | T6: Done | U6: Pri | V6: In | W6: Done | Y6: of:=[.T4] -> 239 | Z6: of:=[.T5] -> 239 | AA6: of:=SUMIFS([.$D$8:.$D$31];[.$H$8:.$H$31];"=X")+SUMIFS([.$D$8:.$D$31];[.$K$8:.$K$31];"=X")+SUMIFS([.$D$8:.$D$31];[.$N$8:.$N$31];"=X")+SUMIFS([.$D$8:.$D$31];[.$Q$8:.$Q$31];"=X")+SUMIFS([.$D$8:.$D$31];[.$S$8:.$S$31];"=X") -> 618 | AB6: of:=SUM([.$Z2:.$Z6]) -> 618
A7: Main Epic User Story | B7: Epic | C7: Mandatory | D7: of:=SUM([.$D8:.$D31]) -> 845 | E7: 1 | Y7: of:=[.W4] -> 227 | Z7: of:=[.W5] -> 175 | AA7: of:=SUMIFS([.$D$8:.$D$31];[.$H$8:.$H$31];"=X")+SUMIFS([.$D$8:.$D$31];[.$K$8:.$K$31];"=X")+SUMIFS([.$D$8:.$D$31];[.$N$8:.$N$31];"=X")+SUMIFS([.$D$8:.$D$31];[.$Q$8:.$Q$31];"=X")+SUMIFS([.$D$8:.$D$31];[.$T$8:.$T$31];"=X")+SUMIFS([.$D$8:.$D$31];[.$V$8:.$V$31];"=X") -> 845 | AB7: of:=SUM([.$Z2:.$Z7]) -> 793
A8: Choose game type | B8: Front-End Interface | C8: Mandatory | D8: 10 | E8: 4.06006006006006 | F8: of:=[.$E8] -> 4.06006006006006 | G8: X | H8: X
A9: Game start | B9: Front-End Interface | C9: Mandatory | D9: 40 | E9: 1.01501501501502 | F9: 1.01501501501502 | G9: X | H9: X
A10: Player pairing cancellation | B10: Front-End Interface | C10: Exciter | D10: 37 | E10: 0.548656764872981 | R10: 0.537183145878798 | S10: X | T10: X
A11: Visible “whose turn it is” | B11: Front-End Interface | C11: Mandatory | D11: 13 | E11: 3.12312312312312 | F11: 3.12312312312312 | G11: X | H11: X
A12: Column availability | B12: Front-End Interface | C12: Mandatory | D12: 18 | E12: 2.25558892225559 | F12: 2.25558892225559 | G12: X | H12: X
A13: Token placing | B13: Front-End Interface | C13: Mandatory | D13: 25 | E13: 1.72552552552553 | F13: 1.72552552552553 | G13: X | H13: X
A14: Visible game board | B14: Front-End Interface | C14: Mandatory | D14: 23 | E14: 1.98589894242068 | F14: 1.98589894242068 | G14: X | H14: X
A15: Final game results | B15: Front-End Interface | C15: Mandatory | D15: 20 | E15: 2.03003003003003 | I15: 2.03003003003003 | J15: X | K15: X
A16: End game options | B16: Front-End Interface | C16: Exciter | D16: 13 | E16: 1.75675675675676 | U16: 1.75675675675676 | V16: X | W16: X
A17: Website URL and availability | B17: Front-End Interface | C17: Linear | D17: 24 | E17: 1.79742242242242 | I17: 1.79742242242242 | J17: X | K17: X
A18: AI implementation | B18: Back-End Implementation | C18: Exciter | D18: 70 | E18: 0.398755898755899 | I18: 0.398755898755899 | J18: X | U18: 0.398755898755899 | V18: X | W18: X
A19: Game logic turn implementation | B19: Back-End Implementation | C19: Mandatory | D19: 30 | E19: 1.35335335335335 | F19: of:=[.$E19] -> 1.35335335335335 | G19: X | L19: 1.35335335335335 | M19: X | O19: 1.35335335335335 | P19: X | R19: 1.35335335335335 | S19: X | T19: X
A20: Game logic record token drop implementation | B20: Back-End Implementation | C20: Mandatory | D20: 65 | E20: 0.624624624624625 | O20: 0.611562350692785 | P20: X | Q20: X
A21: Game logic win/lose/draw state detection | B21: Back-End Implementation | C21: Mandatory | D21: 70 | E21: 0.543758043758044 | I21: 0.543758043758044 | J21: X | R21: 0.543758043758044 | S21: X | T21: X
A22: Multiplayer pairing | B22: Networking | C22: Exciter | D22: 77 | E22: 0.428415428415428 | L22: 0.428415428415428 | M22: X | O22: 0.428415428415428 | P22: X | R22: 0.428415428415428 | S22: X | T22: X
A23: Multiplayer game start | B23: Networking | C23: Mandatory | D23: 25 | E23: 1.82702702702703 | L23: 1.82702702702703 | M23: X | O23: 1.82702702702703 | P23: X | R23: 1.82702702702703 | S23: X | T23: X
A24: Multiplayer game whose turn it is | B24: Networking | C24: Mandatory | D24: 20 | E24: 2.15690690690691 | L24: 2.15690690690691 | M24: X | O24: 2.15690690690691 | P24: X | Q24: X
A25: Multiplayer record turn action | B25: Networking | C25: Mandatory | D25: 20 | E25: 2.03003003003003 | L25: 2.03003003003003 | M25: X | O25: 2.03003003003003 | P25: X | Q25: X
A26: Multiplayer game board state | B26: Networking | C26: Linear | D26: 53 | E26: 0.861805201427843 | O26: 0.861805201427843 | P26: X | Q26: X
A27: Multiplayer end-game state | B27: Networking | C27: Linear | D27: 48 | E27: 0.792980480480481 | O27: 0.792980480480481 | P27: X | Q27: X
A28: In-game emotes | B28: Extra | C28: Exciter | D28: 47 | E28: 0.485911443358252 | U28: 0.485911443358252 | V28: X | W28: X
A29: In-game column emotes | B29: Extra | C29: Exciter | D29: 52 | E29: 0.439189189189189 | U29: 0.439189189189189 | V29: X
A30: Reactivity | B30: Constraint | C30: Mandatory
A31: Multiplayer Phrase Pairing | B31: Networking | C31: Exciter | D31: 45 | E31: 0.620286953620287 | U31: 0.620286953620287 | V31: X | W31: X
A32: Refactoring and Code Improvement | B32: Constraint | C32: Mandatory
D33: Retrospective: | F33: Designing and implementing the front end was difficult at first, since it was my first time using the Yew framework. Was able to get a Minimum Viable Product front-end that should work as the base for future work on the front-end. | I33: AI implementation was not as hard as I thought it would be. I initially gave it 100 points, but reduced it to 70. Admittedly, after implementing it, it still is somewhat flawed sometimes (as noticed during testing it), so it could be tweaked later, which is why the task isn’t complete, but incomplete. The resulting velocity is short of the planned velocity in this and the previous Sprint, but this is only because a single task in each Sprint is just shy of being complete. It appears to be over-commiting, but I don’t think that’s the case. | L33: See the document in the “retrospectives” folder. | O33: See the document in the “retrospectives” folder. | R33: See the document in the “retrospectives” folder. | U33: See the document in the “retrospectives” folder.