Sheet: Sheet1
A1: Task | B1: Status | C1: Start Amount | D1: Monday | E1: Tuesday | F1: Wednesday | G1: Thursday | H1: Friday | I1: Saturday | J1: Sunday
A2: Game Logic turn implementation
A3: Implement turn changer | B3: Pending | C3: 3 | D3: 3 | E3: 3 | F3: 3
A4: Multiplayer Pairing
A5: Front-end to Back-end protocol defined | B5: In Progress | C5: 1 | D5: 1 | E5: 1 | F5: 1
A6: Front-end async handling (figuring it out) | B6: done
A7: Back-end database specification defined | B7: In Progress | C7: 1 | D7: 1 | E7: 1 | F7: 1
A8: Back-end minimum viable product impl | B8: In Progress | C8: 1 | D8: 1 | E8: 0
A9: Front-end to Back-end connection impl | B9: In Progress | C9: 10 | D9: 4 | E9: 7 | F9: 5
A10: Multiplayer Game Start
A11: Front-end and Back-end state sync | B11: In Progress | C11: 4 | D11: 4 | E11: 4 | F11: 3
A12: Multiplayer game whose turn it is
A13: Networked communication turn checking | B13: Pending | C13: 2 | D13: 2 | E13: 2 | F13: 2
A14: Multiplayer record turn action
A15: Networked communication action checking | B15: Pending | C15: 2 | D15: 2 | E15: 2 | F15: 2
A17: Total Hours Assigned | C17: 18 | D17: 18 | E17: 24 | F17: 24
A18: Hours Remaining | C18: 18 | D18: of:=SUM([.D$2:.D$15]) -> 18 | E18: of:=SUM([.E$2:.E$15]) -> 20 | F18: of:=SUM([.F$2:.F$15]) -> 17
A19: Hours Completed | C19: 0 | D19: 0 | E19: of:=[.E$17]-[.E$18] -> 4 | F19: of:=[.F$17]-[.F$18] -> 7