Sheet: User Stories
A1: Short Title | B1: Theme | C1: User Story | D1: Clarifications | E1: Test or Conditions of Satisfaction | F1: Kano Category | G1: Story Points | H1: Relative Benefit | I1: Relative Penalty | J1: Total Value | K1: Value % | L1: Cost % | M1: Priority
A2: Main Epic User Story | B2: Epic | C2: As a player, I would like to play the game Four-Line Dropper, so that I can have fun. | F2: Mandatory | G2: of:=SUM([.$G3:.$G100]) -> 928 | H2: of:=SUM([.$H3:.$H100]) -> 174 | I2: of:=SUM([.$I3:.$I100]) -> 148 | J2: of:=SUM([.$H2:.$I2]) -> 322 | K2: 1 | L2: 1 | M2: of:=[.$K2]/[.$L2] -> 1
A3: Choose game type | B3: Front-End Interface | C3: As a player, I would like to choose to play against the AI, or another Player over the network, or another Player locally, so that I can choose the type of game to play. | D3: The player should be presented with a menu to select the game type. When networking hasn’t yet been implemented, “local-mulitplayer” or “against the AI” are the only options available. | E3: The game type should be selectable. Player is queued for play against another player, or starts a game against an AI, or starts a game in “Local-Multiplayer” mode. | F3: Mandatory | G3: 10 | H3: 8 | I3: 8 | J3: of:=SUM([.$H3:.$I3]) -> 16 | K3: of:=[.$J3]/[.$J$2] -> 0.0496894409937888 | L3: of:=[.$G3]/[.$G$2] -> 0.0107758620689655 | M3: of:=[.$K3]/[.$L3] -> 4.6111801242236
A4: Game start | B4: Front-End Interface | C4: As a player, I would like to know when the game has started, so that I know to start playing the game. | E4: The game should start once the current Player has been paired with another player, or immediately after choosing to play against an AI or local Player. If pairing has not yet ocurred, it should be obvious that pairing is still pending. | F4: Mandatory | G4: 40 | H4: 8 | I4: 8 | J4: of:=SUM([.$H4:.$I4]) -> 16 | K4: of:=[.$J4]/[.$J$2] -> 0.0496894409937888 | L4: of:=[.$G4]/[.$G$2] -> 0.0431034482758621 | M4: of:=[.$K4]/[.$L4] -> 1.1527950310559
A5: Player pairing cancellation | B5: Front-End Interface | C5: As a player, I would like to abort playing against another Player and play against an AI, so that I don’t have to keep waiting for the game to start. | E5: The player should be able to remove themselves from the pairing process and immediately start a game against an AI. | F5: Exciter | G5: 37 | H5: 6 | I5: 2 | J5: of:=SUM([.$H5:.$I5]) -> 8 | K5: of:=[.$J5]/[.$J$2] -> 0.0248447204968944 | L5: of:=[.$G5]/[.$G$2] -> 0.0398706896551724 | M5: of:=[.$K5]/[.$L5] -> 0.623132449219406
A6: Visible “whose turn it is” | B6: Front-End Interface | C6: As a player, I would like to see who’s turn it is, so that I can wait for my turn and play when it is my turn. | E6: It should be obvious whose turn it is during gameplay. | F6: Mandatory | G6: 13 | H6: 7 | I6: 9 | J6: of:=SUM([.$H6:.$I6]) -> 16 | K6: of:=[.$J6]/[.$J$2] -> 0.0496894409937888 | L6: of:=[.$G6]/[.$G$2] -> 0.0140086206896552 | M6: of:=[.$K6]/[.$L6] -> 3.54706163401816
A7: Column availability | B7: Front-End Interface | C7: As a player, I would like to know which columns of the game board are available to place tokens, so that I can pick a column to place a token. | E7: It should be obvious which columns can accept a dropped token. | F7: Mandatory | G7: 18 | H7: 8 | I7: 8 | J7: of:=SUM([.$H7:.$I7]) -> 16 | K7: of:=[.$J7]/[.$J$2] -> 0.0496894409937888 | L7: of:=[.$G7]/[.$G$2] -> 0.0193965517241379 | M7: of:=[.$K7]/[.$L7] -> 2.56176673567978
A8: Token placing | B8: Front-End Interface | C8: As a player, I would like to place a token in an available column of my choosing, so that I could finish my turn. | D8: An available column is a column in the game board that is not full. | E8: A player should be able to place a token into an available column. | F8: Mandatory | G8: 25 | H8: 9 | I8: 8 | J8: of:=SUM([.$H8:.$I8]) -> 17 | K8: of:=[.$J8]/[.$J$2] -> 0.0527950310559006 | L8: of:=[.$G8]/[.$G$2] -> 0.0269396551724138 | M8: of:=[.$K8]/[.$L8] -> 1.95975155279503
A9: Visible game board | B9: Front-End Interface | C9: As a player, I would like to see the game board, so that I can see the current state of the game and plan accordingly. | D9: The game board is 7 tokens wide and 8 tokens tall. | E9: The size of the board and all tokens on the board should be visible. | F9: Mandatory | G9: 23 | H9: 9 | I9: 9 | J9: of:=SUM([.$H9:.$I9]) -> 18 | K9: of:=[.$J9]/[.$J$2] -> 0.0559006211180124 | L9: of:=[.$G9]/[.$G$2] -> 0.0247844827586207 | M9: of:=[.$K9]/[.$L9] -> 2.25546853902241
A10: Final game results | B10: Front-End Interface | C10: As a player, I would like to see if the game is over, so that I can know if the game is over and if I have won or not. | E10: It should be obvious if the game has ended and who the winner is in that case. | F10: Mandatory | G10: 20 | H10: 8 | I10: 8 | J10: of:=SUM([.$H10:.$I10]) -> 16 | K10: of:=[.$J10]/[.$J$2] -> 0.0496894409937888 | L10: of:=[.$G10]/[.$G$2] -> 0.021551724137931 | M10: of:=[.$K10]/[.$L10] -> 2.3055900621118
A11: End game options | B11: Front-End Interface | C11: As a player, I would like to choose to play again if the game has ended, so that I can continue playing. | E11: The player should be able to return to the very first state of the game to start over. | F11: Exciter | G11: 13 | H11: 6 | I11: 3 | J11: of:=SUM([.$H11:.$I11]) -> 9 | K11: of:=[.$J11]/[.$J$2] -> 0.0279503105590062 | L11: of:=[.$G11]/[.$G$2] -> 0.0140086206896552 | M11: of:=[.$K11]/[.$L11] -> 1.99522216913521
A12: Website URL and availability | B12: Front-End Interface | C12: As a player, I would like to know the URL of the website for Four-Line Dropper, so that I can visit the website and play the game. | E12: A webserver should serve the game’s front-end and the URL of the webserver should be given to Players. | F12: Linear | G12: 24 | H12: 9 | I12: 8 | J12: of:=SUM([.$H12:.$I12]) -> 17 | K12: of:=[.$J12]/[.$J$2] -> 0.0527950310559006 | L12: of:=[.$G12]/[.$G$2] -> 0.0258620689655172 | M12: of:=[.$K12]/[.$L12] -> 2.04140786749482
A13: AI implementation | B13: Back-End Implementation | C13: As a player, I would like to play against the AI, so that I can play “singleplayer mode”. | D13: AI is expected to be “Utility-AI” based. | E13: The AI should be implemented such that a full game of Four-Line Dropper can be played with it. | F13: Exciter | G13: 100 | H13: 7 | I13: 4 | J13: of:=SUM([.$H13:.$I13]) -> 11 | K13: of:=[.$J13]/[.$J$2] -> 0.0341614906832298 | L13: of:=[.$G13]/[.$G$2] -> 0.107758620689655 | M13: of:=[.$K13]/[.$L13] -> 0.317018633540373
A14: Game logic turn implementation | B14: Back-End Implementation | C14: As a player, I would like to play the game expecting that the game knows whose turn it is, so that the game can progress. | E14: The game should keep track of whose turn it is. | F14: Mandatory | G14: 30 | H14: 8 | I14: 8 | J14: of:=SUM([.$H14:.$I14]) -> 16 | K14: of:=[.$J14]/[.$J$2] -> 0.0496894409937888 | L14: of:=[.$G14]/[.$G$2] -> 0.0323275862068966 | M14: of:=[.$K14]/[.$L14] -> 1.53706004140787
A15: Game logic record token drop implementation | B15: Back-End Implementation | C15: As a player, I would like to play the game expecting that my moves are recorded, so that the game keeps track of everyone’s moves. | E15: The game should be able to record and keep track of tokens placed by Player(s) and/or AI. | F15: Mandatory | G15: 65 | H15: 8 | I15: 8 | J15: of:=SUM([.$H15:.$I15]) -> 16 | K15: of:=[.$J15]/[.$J$2] -> 0.0496894409937888 | L15: of:=[.$G15]/[.$G$2] -> 0.0700431034482759 | M15: of:=[.$K15]/[.$L15] -> 0.709412326803631
A16: Game logic win/lose/draw state detection | B16: Back-End Implementation | C16: As a player, I would like to play the game expecting that the game knows when it has ended, so that the game works as expected. | D16: Win/Lose if a player has 4 in a row/column/diagonal or a draw if no more tokens can be placed. | E16: The game should be able to detect end-game state. | F16: Mandatory | G16: 70 | H16: 8 | I16: 7 | J16: of:=SUM([.$H16:.$I16]) -> 15 | K16: of:=[.$J16]/[.$J$2] -> 0.046583850931677 | L16: of:=[.$G16]/[.$G$2] -> 0.0754310344827586 | M16: of:=[.$K16]/[.$L16] -> 0.61756876663709
A17: Multiplayer pairing | B17: Networking | C17: As a player, I would like to be able to pair with another Player, so that I can play a multiplayer game. | E17: The front-end should be able to communicate with the back-end server to enqueue a Player to pair against another Player. | F17: Exciter | G17: 77 | H17: 8 | I17: 5 | J17: of:=SUM([.$H17:.$I17]) -> 13 | K17: of:=[.$J17]/[.$J$2] -> 0.0403726708074534 | L17: of:=[.$G17]/[.$G$2] -> 0.0829741379310345 | M17: of:=[.$K17]/[.$L17] -> 0.486569331289828
A18: Multiplayer game start | B18: Networking | C18: As a player, I would like to know when the game has started a multiplayer game, so that I can play a multiplayer game. | E18: The back-end should communicate to the front-end(s) that the game has started and whose turn it is. This will occur after a Player has been paired. | F18: Mandatory | G18: 45 | H18: 9 | I18: 9 | J18: of:=SUM([.$H18:.$I18]) -> 18 | K18: of:=[.$J18]/[.$J$2] -> 0.0559006211180124 | L18: of:=[.$G18]/[.$G$2] -> 0.0484913793103448 | M18: of:=[.$K18]/[.$L18] -> 1.1527950310559
A19: Multiplayer game whose turn it is | B19: Networking | C19: As a player, I would like to play a multiplayer game knowing whose turn it is, so that the game can progress. | E19: The back-end should communicate whose turn it is to the front-end(s). | F19: Mandatory | G19: 50 | H19: 9 | I19: 8 | J19: of:=SUM([.$H19:.$I19]) -> 17 | K19: of:=[.$J19]/[.$J$2] -> 0.0527950310559006 | L19: of:=[.$G19]/[.$G$2] -> 0.0538793103448276 | M19: of:=[.$K19]/[.$L19] -> 0.979875776397516
A20: Multiplayer record turn action | B20: Networking | C20: As a player, I would like to play a multiplayer game knowing that the game keeps track of each Player’s turn, so that the game can progress. | E20: The front-end and back-end should communicate a Player’s decision on their turn to be stored in the back-end. | F20: Mandatory | G20: 68 | H20: 8 | I20: 8 | J20: of:=SUM([.$H20:.$I20]) -> 16 | K20: of:=[.$J20]/[.$J$2] -> 0.0496894409937888 | L20: of:=[.$G20]/[.$G$2] -> 0.0732758620689655 | M20: of:=[.$K20]/[.$L20] -> 0.67811472415053
A21: Multiplayer game board state | B21: Networking | C21: As a player, I would like to play a multiplayer game knowing the board’s state, so that I can accurately know the board’s state. | E21: The back-end should communicate the state of the game board to the front-end(s). | F21: Linear | G21: 53 | H21: 9 | I21: 9 | J21: of:=SUM([.$H21:.$I21]) -> 18 | K21: of:=[.$J21]/[.$J$2] -> 0.0559006211180124 | L21: of:=[.$G21]/[.$G$2] -> 0.0571120689655172 | M21: of:=[.$K21]/[.$L21] -> 0.978788233915387
A22: Multiplayer end-game state | B22: Networking | C22: As a player, I would like to know if a multiplayer game has ended, so that I can see the results. | E22: The back-end should communicate to the front-end(s) that the game has ended and who the winner/loser is or if it has ended in a draw. | F22: Linear | G22: 48 | H22: 8 | I22: 7 | J22: of:=SUM([.$H22:.$I22]) -> 15 | K22: of:=[.$J22]/[.$J$2] -> 0.046583850931677 | L22: of:=[.$G22]/[.$G$2] -> 0.0517241379310345 | M22: of:=[.$K22]/[.$L22] -> 0.900621118012422
A23: In-game emotes | B23: Extra | C23: As a player, I would like to communicate with the other player with the available in-game emotes, so that I can have some banter with the opponent. | E23: The front-end should be able to send user-selected emotes to the back-end, to be communicated to the other player’s front-end. | F23: Exciter | G23: 47 | H23: 7 | I23: 2 | J23: of:=SUM([.$H23:.$I23]) -> 9 | K23: of:=[.$J23]/[.$J$2] -> 0.0279503105590062 | L23: of:=[.$G23]/[.$G$2] -> 0.0506465517241379 | M23: of:=[.$K23]/[.$L23] -> 0.551869961675697
A24: In-game column emotes | B24: Extra | C24: As a player, I would like to communicate with the other player with the available in-game emotes to highlight a specific column, so that I can have some banter with the opponent. | E24: The front-end should be able to send user-selected emotes on a specific column to the back-end, to be communicated to the other player’s front-end. | F24: Exciter | G24: 52 | H24: 7 | I24: 2 | J24: of:=SUM([.$H24:.$I24]) -> 9 | K24: of:=[.$J24]/[.$J$2] -> 0.0279503105590062 | L24: of:=[.$G24]/[.$G$2] -> 0.0560344827586207 | M24: of:=[.$K24]/[.$L24] -> 0.498805542283803